{
  "contract_version": "a4-analysis-v0.2.0",
  "status": "abstain",
  "reason_codes": [
    "essential_evidence_missing"
  ],
  "fixture": {
    "fixture_id": "900",
    "home_team_id": "H",
    "away_team_id": "A",
    "home": "Synthetic Home",
    "away": "Synthetic Away",
    "competition_id": "39",
    "competition": "Synthetic League",
    "country": "Test",
    "kickoff_utc": "2026-10-25T16:00:00Z",
    "evidence_cutoff_utc": "2026-10-25T12:00:00Z",
    "venue": null,
    "format": "league",
    "settlement": "regulation_90_plus_stoppage_excluding_extra_time_and_penalties"
  },
  "packet_hash": "1a2e501feddb3dc5f6aa32cb1341d1210d1c2aecbf22e785ff24730a8437d176",
  "topics": [
    {
      "topic": "identity_context",
      "state": "supported",
      "conclusion": "Identity and source limitations are recorded.",
      "evidence_refs": [],
      "metric_refs": [],
      "limitations": [
        "Synthetic evidence does not validate future performance."
      ],
      "claim_refs": []
    },
    {
      "topic": "attacking_performance",
      "state": "partial",
      "conclusion": "Observed football performance requires cautious interpretation.",
      "evidence_refs": [
        "H-0:goals_for",
        "H-0:xg_for",
        "H-0:shots_for",
        "H-0:shots_on_target",
        "H-1:goals_for",
        "H-1:xg_for",
        "H-1:shots_for",
        "H-1:shots_on_target",
        "H-2:goals_for",
        "H-2:xg_for",
        "H-2:shots_for",
        "H-2:shots_on_target",
        "H-3:goals_for",
        "H-3:xg_for",
        "H-3:shots_for",
        "H-3:shots_on_target",
        "H-4:goals_for",
        "H-4:xg_for",
        "H-4:shots_for",
        "H-4:shots_on_target",
        "H-5:goals_for",
        "H-5:xg_for",
        "H-5:shots_for",
        "H-5:shots_on_target",
        "H-6:goals_for",
        "H-6:xg_for",
        "H-6:shots_for",
        "H-6:shots_on_target",
        "H-7:goals_for",
        "H-7:xg_for",
        "H-7:shots_for",
        "H-7:shots_on_target",
        "H-8:goals_for",
        "H-8:xg_for",
        "H-8:shots_for",
        "H-8:shots_on_target",
        "H-9:goals_for",
        "H-9:xg_for",
        "H-9:shots_for",
        "H-9:shots_on_target",
        "A-0:goals_for",
        "A-0:xg_for",
        "A-0:shots_for",
        "A-0:shots_on_target",
        "A-1:goals_for",
        "A-1:xg_for",
        "A-1:shots_for",
        "A-1:shots_on_target",
        "A-2:goals_for",
        "A-2:xg_for",
        "A-2:shots_for",
        "A-2:shots_on_target",
        "A-3:goals_for",
        "A-3:xg_for",
        "A-3:shots_for",
        "A-3:shots_on_target",
        "A-4:goals_for",
        "A-4:xg_for",
        "A-4:shots_for",
        "A-4:shots_on_target",
        "A-5:goals_for",
        "A-5:xg_for",
        "A-5:shots_for",
        "A-5:shots_on_target",
        "A-6:goals_for",
        "A-6:xg_for",
        "A-6:shots_for",
        "A-6:shots_on_target",
        "A-7:goals_for",
        "A-7:xg_for",
        "A-7:shots_for",
        "A-7:shots_on_target",
        "A-8:goals_for",
        "A-8:xg_for",
        "A-8:shots_for",
        "A-8:shots_on_target",
        "A-9:goals_for",
        "A-9:xg_for",
        "A-9:shots_for",
        "A-9:shots_on_target"
      ],
      "metric_refs": [],
      "limitations": [
        "Synthetic evidence does not validate future performance."
      ],
      "claim_refs": []
    },
    {
      "topic": "defensive_performance",
      "state": "partial",
      "conclusion": "Observed football performance requires cautious interpretation.",
      "evidence_refs": [
        "H-0:goals_against",
        "H-0:xg_against",
        "H-0:shots_against",
        "H-1:goals_against",
        "H-1:xg_against",
        "H-1:shots_against",
        "H-2:goals_against",
        "H-2:xg_against",
        "H-2:shots_against",
        "H-3:goals_against",
        "H-3:xg_against",
        "H-3:shots_against",
        "H-4:goals_against",
        "H-4:xg_against",
        "H-4:shots_against",
        "H-5:goals_against",
        "H-5:xg_against",
        "H-5:shots_against",
        "H-6:goals_against",
        "H-6:xg_against",
        "H-6:shots_against",
        "H-7:goals_against",
        "H-7:xg_against",
        "H-7:shots_against",
        "H-8:goals_against",
        "H-8:xg_against",
        "H-8:shots_against",
        "H-9:goals_against",
        "H-9:xg_against",
        "H-9:shots_against",
        "A-0:goals_against",
        "A-0:xg_against",
        "A-0:shots_against",
        "A-1:goals_against",
        "A-1:xg_against",
        "A-1:shots_against",
        "A-2:goals_against",
        "A-2:xg_against",
        "A-2:shots_against",
        "A-3:goals_against",
        "A-3:xg_against",
        "A-3:shots_against",
        "A-4:goals_against",
        "A-4:xg_against",
        "A-4:shots_against",
        "A-5:goals_against",
        "A-5:xg_against",
        "A-5:shots_against",
        "A-6:goals_against",
        "A-6:xg_against",
        "A-6:shots_against",
        "A-7:goals_against",
        "A-7:xg_against",
        "A-7:shots_against",
        "A-8:goals_against",
        "A-8:xg_against",
        "A-8:shots_against",
        "A-9:goals_against",
        "A-9:xg_against",
        "A-9:shots_against"
      ],
      "metric_refs": [],
      "limitations": [
        "Synthetic evidence does not validate future performance."
      ],
      "claim_refs": []
    },
    {
      "topic": "recent_form",
      "state": "partial",
      "conclusion": "Observed football performance requires cautious interpretation.",
      "evidence_refs": [
        "H-0:goals_for",
        "H-0:goals_against",
        "H-0:xg_for",
        "H-0:xg_against",
        "H-0:shots_for",
        "H-0:shots_against",
        "H-0:shots_on_target",
        "H-1:goals_for",
        "H-1:goals_against",
        "H-1:xg_for",
        "H-1:xg_against",
        "H-1:shots_for",
        "H-1:shots_against",
        "H-1:shots_on_target",
        "H-2:goals_for",
        "H-2:goals_against",
        "H-2:xg_for",
        "H-2:xg_against",
        "H-2:shots_for",
        "H-2:shots_against",
        "H-2:shots_on_target",
        "H-3:goals_for",
        "H-3:goals_against",
        "H-3:xg_for",
        "H-3:xg_against",
        "H-3:shots_for",
        "H-3:shots_against",
        "H-3:shots_on_target",
        "H-4:goals_for",
        "H-4:goals_against",
        "H-4:xg_for",
        "H-4:xg_against",
        "H-4:shots_for",
        "H-4:shots_against",
        "H-4:shots_on_target",
        "H-5:goals_for",
        "H-5:goals_against",
        "H-5:xg_for",
        "H-5:xg_against",
        "H-5:shots_for",
        "H-5:shots_against",
        "H-5:shots_on_target",
        "H-6:goals_for",
        "H-6:goals_against",
        "H-6:xg_for",
        "H-6:xg_against",
        "H-6:shots_for",
        "H-6:shots_against",
        "H-6:shots_on_target",
        "H-7:goals_for",
        "H-7:goals_against",
        "H-7:xg_for",
        "H-7:xg_against",
        "H-7:shots_for",
        "H-7:shots_against",
        "H-7:shots_on_target",
        "H-8:goals_for",
        "H-8:goals_against",
        "H-8:xg_for",
        "H-8:xg_against",
        "H-8:shots_for",
        "H-8:shots_against",
        "H-8:shots_on_target",
        "H-9:goals_for",
        "H-9:goals_against",
        "H-9:xg_for",
        "H-9:xg_against",
        "H-9:shots_for",
        "H-9:shots_against",
        "H-9:shots_on_target",
        "A-0:goals_for",
        "A-0:goals_against",
        "A-0:xg_for",
        "A-0:xg_against",
        "A-0:shots_for",
        "A-0:shots_against",
        "A-0:shots_on_target",
        "A-1:goals_for",
        "A-1:goals_against",
        "A-1:xg_for",
        "A-1:xg_against",
        "A-1:shots_for",
        "A-1:shots_against",
        "A-1:shots_on_target",
        "A-2:goals_for",
        "A-2:goals_against",
        "A-2:xg_for",
        "A-2:xg_against",
        "A-2:shots_for",
        "A-2:shots_against",
        "A-2:shots_on_target",
        "A-3:goals_for",
        "A-3:goals_against",
        "A-3:xg_for",
        "A-3:xg_against",
        "A-3:shots_for",
        "A-3:shots_against",
        "A-3:shots_on_target",
        "A-4:goals_for",
        "A-4:goals_against",
        "A-4:xg_for",
        "A-4:xg_against",
        "A-4:shots_for",
        "A-4:shots_against",
        "A-4:shots_on_target",
        "A-5:goals_for",
        "A-5:goals_against",
        "A-5:xg_for",
        "A-5:xg_against",
        "A-5:shots_for",
        "A-5:shots_against",
        "A-5:shots_on_target",
        "A-6:goals_for",
        "A-6:goals_against",
        "A-6:xg_for",
        "A-6:xg_against",
        "A-6:shots_for",
        "A-6:shots_against",
        "A-6:shots_on_target",
        "A-7:goals_for",
        "A-7:goals_against",
        "A-7:xg_for",
        "A-7:xg_against",
        "A-7:shots_for",
        "A-7:shots_against",
        "A-7:shots_on_target",
        "A-8:goals_for",
        "A-8:goals_against",
        "A-8:xg_for",
        "A-8:xg_against",
        "A-8:shots_for",
        "A-8:shots_against",
        "A-8:shots_on_target",
        "A-9:goals_for",
        "A-9:goals_against",
        "A-9:xg_for",
        "A-9:xg_against",
        "A-9:shots_for",
        "A-9:shots_against",
        "A-9:shots_on_target"
      ],
      "metric_refs": [],
      "limitations": [
        "Synthetic evidence does not validate future performance."
      ],
      "claim_refs": []
    },
    {
      "topic": "home_away",
      "state": "partial",
      "conclusion": "Observed football performance requires cautious interpretation.",
      "evidence_refs": [
        "H-0:goals_for",
        "H-0:goals_against",
        "H-1:goals_for",
        "H-1:goals_against",
        "H-2:goals_for",
        "H-2:goals_against",
        "H-3:goals_for",
        "H-3:goals_against",
        "H-4:goals_for",
        "H-4:goals_against",
        "H-5:goals_for",